question,answer
what is apple pie?,Apple pie is a classic dessert made with a pastry crust and a sweet apple filling, often flavored with cinnamon.
where does apple pie come from?,Apple pie is associated with American cuisine but has origins in Europe.
what are the main ingredients in apple pie?,The main ingredients are apples, sugar, cinnamon, flour, butter, and pastry dough.
how is apple pie cooked?,Apple pie is baked in an oven until the crust is golden and the filling is bubbly.
is apple pie served hot or cold?,Apple pie can be served hot or cold, often with ice cream or whipped cream.
what are baby back ribs?,Baby back ribs are pork ribs taken from the top of the rib cage between the spine and the spare ribs.
how are baby back ribs cooked?,They are usually seasoned, slow-cooked, and finished on a grill or in the oven with barbecue sauce.
what cuisine are baby back ribs from?,They are popular in American cuisine, especially in Southern barbecue.
what do baby back ribs taste like?,They are tender, juicy, and flavorful, often with a smoky, sweet, or tangy taste.
what is served with baby back ribs?,Common sides include coleslaw, baked beans, and cornbread.
what is baklava?,Baklava is a sweet pastry made of layers of filo dough, filled with chopped nuts, and sweetened with syrup or honey.
where does baklava come from?,Baklava is a traditional dessert in Middle Eastern, Turkish, and Greek cuisines.
what nuts are used in baklava?,Common nuts include pistachios, walnuts, and almonds.
how is baklava made?,Layers of filo dough are brushed with butter, filled with nuts, baked, and soaked in syrup.
is baklava served hot or cold?,Baklava is usually served at room temperature.
what is beef carpaccio?,Beef carpaccio is a dish of thinly sliced raw beef, typically served as an appetizer.
where does beef carpaccio come from?,It originated in Italy.
how is beef carpaccio prepared?,Raw beef is sliced thin, arranged on a plate, and drizzled with olive oil and lemon juice.
what is served with beef carpaccio?,It is often garnished with capers, onions, and shaved parmesan cheese.
is beef carpaccio safe to eat?,It is safe if prepared with high-quality, fresh beef and proper hygiene.
what is beef tartare?,Beef tartare is a dish made from finely chopped or ground raw beef, often mixed with seasonings and a raw egg yolk.
where does beef tartare come from?,It is a classic French dish.
how is beef tartare served?,It is served raw,seasoned with onions, capers, Worcestershire sauce, and sometimes mustard.
what is the texture of beef tartare?,It is tender and smooth, with a rich flavor.
is beef tartare safe to eat?,It is safe if made with fresh, high-quality beef and proper food safety.
what is beet salad?,Beet salad is a dish made with cooked or raw beets, often combined with cheese, nuts, and greens.
what are the main ingredients in beet salad?,Beets, goat cheese or feta, walnuts or pecans, and leafy greens.
how is beet salad prepared?,Beets are roasted or boiled, sliced, and tossed with other ingredients and dressing.
is beet salad healthy?,Yes, it is rich in fiber, vitamins, and minerals.
what dressing goes with beet salad?,Common dressings include vinaigrette or balsamic reduction.
what are beignets?,Beignets are deep-fried pastries, similar to doughnuts, dusted with powdered sugar.
where do beignets come from?,They are a specialty of New Orleans, Louisiana, with French origins.
how are beignets made?,A yeast dough is rolled out, cut into squares, and deep-fried until puffy.
when are beignets eaten?,They are often enjoyed as a breakfast or dessert.
what is served with beignets?,They are commonly served with coffee, especially café au lait.
what is bibimbap?,Bibimbap is a Korean rice dish topped with assorted vegetables, meat, and a fried egg.
what does bibimbap mean?,Bibimbap means "mixed rice" in Korean.
how is bibimbap served?,Ingredients are arranged on rice and mixed together before eating, often with gochujang (chili paste).
is bibimbap spicy?,It can be spicy if gochujang is added.
is bibimbap healthy?,Yes, it is balanced and nutritious, with vegetables, protein, and rice.
what is bread pudding?,Bread pudding is a dessert made from stale bread soaked in a mixture of milk, eggs, sugar, and spices, then baked.
where does bread pudding come from?,It is popular in British and American cuisines.
how is bread pudding served?,It is served warm, often with a sauce such as vanilla, caramel, or whiskey.
what bread is best for bread pudding?,Day-old or stale bread works best.
is bread pudding easy to make?,Yes, it is a simple and comforting dessert.
what is a breakfast burrito?,A breakfast burrito is a flour tortilla filled with breakfast ingredients like eggs, cheese, and meat.
where did the breakfast burrito originate?,It originated in the Southwestern United States.
what goes in a breakfast burrito?,Common fillings include scrambled eggs, bacon or sausage, cheese, potatoes, and salsa.
is a breakfast burrito healthy?,It can be healthy depending on the ingredients used.
can breakfast burritos be made ahead?,Yes, they can be made ahead and reheated.
what is lasagna?,Lasagna is an Italian pasta dish made with layers of pasta, meat or vegetables, cheese, and tomato sauce.
where does lasagna come from?,Lasagna originated in Italy, particularly in the region of Emilia-Romagna.
what are the main ingredients in lasagna?,Pasta sheets, ricotta or béchamel, mozzarella, tomato sauce, and ground meat or vegetables.
how is lasagna cooked?,Lasagna is assembled in layers and baked in the oven until bubbly and golden.
what is served with lasagna?,It is often served with garlic bread or a green salad.
what is a lobster roll sandwich?,A lobster roll is a sandwich filled with lobster meat, usually served in a split-top hot dog bun.
where did the lobster roll originate?,It originated in New England, USA.
what is in a lobster roll?,Lobster meat, mayonnaise, lemon juice, celery, and sometimes lettuce or chives.
how is a lobster roll served?,It is served cold or warm, often with potato chips or fries.
what makes a lobster roll special?,The freshness and sweetness of the lobster meat make it special.
what is macaroni and cheese?,Macaroni and cheese is a comfort food dish made with cooked macaroni pasta and a cheese sauce.
where did macaroni and cheese originate?,It is popular in the United States but has European origins.
what cheese is used in macaroni and cheese?,Cheddar is most common, but other cheeses can be used.
how is macaroni and cheese cooked?,Pasta is mixed with cheese sauce and baked or served creamy.
what is served with macaroni and cheese?,It can be served as a main or side dish, often with vegetables or salad.
what are macarons?,Macarons are delicate French cookies made with almond flour, egg whites, and a creamy filling.
where do macarons come from?,They originated in France.
what is the texture of macarons?,They are crisp on the outside and chewy on the inside.
how are macarons made?,Egg whites are whipped and folded with almond flour and sugar, piped into rounds, baked, and sandwiched with filling.
what flavors do macarons come in?,They come in many flavors, such as chocolate, raspberry, pistachio, and lemon.
what is an omelette?,An omelette is a dish made from beaten eggs cooked in a frying pan, often folded around fillings.
how is an omelette made?,Eggs are beaten, poured into a pan, cooked, and folded with fillings like cheese, vegetables, or ham.
what fillings go in an omelette?,Common fillings include cheese, mushrooms, spinach, tomatoes, and ham.
is an omelette healthy?,Yes, it is high in protein and can be healthy depending on the fillings.
what is served with an omelette?,It is often served with toast, salad, or potatoes.
what are onion rings?,Onion rings are slices of onion dipped in batter or breadcrumbs and deep-fried until crispy.
where did onion rings originate?,They are popular in American cuisine.
how are onion rings made?,Onion slices are coated in batter or breadcrumbs and deep-fried.
what is served with onion rings?,They are often served as a side dish with burgers or sandwiches.
what sauce goes with onion rings?,Common sauces include ketchup, ranch, or barbecue sauce.
what is pad thai?,Pad Thai is a stir-fried noodle dish from Thailand, made with rice noodles, eggs, tofu or shrimp, and peanuts.
where does pad thai come from?,Pad Thai is a popular street food in Thailand.
what are the main ingredients in pad thai?,Rice noodles, eggs, tofu or shrimp, bean sprouts, peanuts, and tamarind sauce.
how is pad thai cooked?,Ingredients are stir-fried together in a wok.
is pad thai spicy?,It can be spicy depending on the amount of chili used.
what is paella?,Paella is a Spanish rice dish originally from Valencia, cooked with saffron, vegetables, and various meats or seafood.
where does paella come from?,Paella comes from the Valencia region of Spain.
what are the main ingredients in paella?,Rice, saffron, vegetables, and a mix of seafood, chicken, or rabbit.
how is paella cooked?,It is cooked in a wide, shallow pan over an open flame or stovetop.
what makes paella unique?,The use of saffron and the socarrat (crispy rice at the bottom) make it unique.
what are pancakes?,Pancakes are flat cakes made from a batter of flour, eggs, milk, and baking powder, cooked on a griddle or pan.
where did pancakes originate?,Pancakes are enjoyed worldwide, with variations in many cultures.
what are pancakes served with?,They are often served with syrup, butter, fruit, or whipped cream.
how are pancakes cooked?,Batter is poured onto a hot griddle or pan and cooked until golden on both sides.
are pancakes sweet or savory?,They can be either, depending on the toppings and fillings.
what is spaghetti carbonara?,Spaghetti carbonara is an Italian pasta dish made with eggs, cheese, pancetta, and black pepper.
where does spaghetti carbonara come from?,It originated in Rome, Italy.
what are the main ingredients in spaghetti carbonara?,Spaghetti, eggs, pecorino or parmesan cheese, pancetta or guanciale, and black pepper.
how is spaghetti carbonara cooked?,Cooked pasta is tossed with a sauce made from eggs, cheese, and pancetta.
is cream used in carbonara?,Traditional carbonara does not use cream.
what are spring rolls?,Spring rolls are a type of appetizer consisting of vegetables and sometimes meat wrapped in a thin pastry and fried or served fresh.
where do spring rolls come from?,They are popular in East and Southeast Asian cuisines.
what is in a spring roll?,Common fillings include cabbage, carrots, mushrooms, and sometimes pork or shrimp.
how are spring rolls cooked?,They can be deep-fried or served fresh (unfried) with dipping sauce.
what sauce is served with spring rolls?,Common sauces include sweet chili, soy, or peanut sauce.
what is steak?,Steak is a cut of meat, usually beef, that is cooked by grilling, pan-frying, or broiling.
what are the different types of steak?,Types include ribeye, sirloin, filet mignon, and T-bone.
how is steak cooked?,Steak can be cooked rare, medium, or well-done, depending on preference.
what is served with steak?,Common sides include potatoes, vegetables, and sauces like peppercorn or béarnaise.
how do you make steak tender?,Proper cooking and resting, as well as marinating, can make steak tender.
what are waffles?,Waffles are a breakfast food made from a batter cooked in a waffle iron to create a grid pattern.
where did waffles originate?,Waffles originated in Belgium.
what are waffles served with?,They are often served with syrup, butter, fruit, or whipped cream.
how are waffles made?,Batter is poured into a waffle iron and cooked until crisp and golden.
are waffles sweet or savory?,They can be either, depending on the toppings and mix-ins.
What is the process for preparing [dish]?,To prepare [dish], ask: what are the steps to preparing [dish] for a detailed guide.
What are the procedures involved in preparing [dish]?,To prepare [dish], ask: what are the steps to preparing [dish] for a detailed guide.
How is [dish] prepared?,To prepare [dish], ask: what are the steps to preparing [dish] for a detailed guide.
What preparation is required for [dish]?,To prepare [dish], ask: what are the steps to preparing [dish] for a detailed guide.
What does the preparation for [dish] entail?,To prepare [dish], ask: what are the steps to preparing [dish] for a detailed guide.
How should one go about preparing [dish]?,To prepare [dish], ask: what are the steps to preparing [dish] for a detailed guide.
How do you get ready for [dish]?,To prepare [dish], ask: what are the steps to preparing [dish] for a detailed guide.
How do you prepare for [dish]?,To prepare [dish], ask: what are the steps to preparing [dish] for a detailed guide.
What do you need to do to prepare [dish]?,To prepare [dish], ask: what are the steps to preparing [dish] for a detailed guide.
What's the prep like for [dish]?,To prepare [dish], ask: what are the steps to preparing [dish] for a detailed guide.
What goes into getting ready for [dish]?,To prepare [dish], ask: what are the steps to preparing [dish] for a detailed guide.
What is the step-by-step guide to preparing [dish]?,To prepare [dish], ask: what are the steps to preparing [dish] for a detailed guide.
What are the key stages in preparing [dish]?,To prepare [dish], ask: what are the steps to preparing [dish] for a detailed guide.
Can you outline the steps to prepare [dish]?,To prepare [dish], ask: what are the steps to preparing [dish] for a detailed guide.
What's the best way to go about preparing [dish]?,To prepare [dish], ask: what are the steps to preparing [dish] for a detailed guide.
What ingredients are in [dish]?,The main ingredients are ...
What do you need to make [dish]?,The main ingredients are ...
What goes into [dish]?,The main ingredients are ...
What is [dish] made of?,The main ingredients are ...
What are the components of [dish]?,The main ingredients are ...
What do I need for [dish]?,The main ingredients are ...
What are the main ingredients for [dish]?,The main ingredients are ...

Where does [dish] come from?,[dish] is associated with ...
What is the origin of [dish]?,[dish] is associated with ...
Which country is [dish] from?,[dish] is associated with ...
What culture is [dish] associated with?,[dish] is associated with ...
What is the background of [dish]?,[dish] is associated with ...

How is [dish] served?,[dish] is served ...
What do you serve with [dish]?,[dish] is served ...
What is [dish] usually served with?,[dish] is served ...
What are common sides for [dish]?,[dish] is served ...
What accompaniments go with [dish]?,[dish] is served ...

How do you cook [dish]?,[dish] is cooked ...
What is the cooking method for [dish]?,[dish] is cooked ...
How is [dish] prepared?,[dish] is cooked ...
How do you make [dish]?,[dish] is cooked ...
What's the best way to cook [dish]?,[dish] is cooked ...
How long does it take to cook [dish]?,[dish] is cooked ...

What does [dish] taste like?,[dish] tastes ...
How does [dish] taste?,[dish] tastes ...
What is the texture of [dish]?,[dish] tastes ...
Is [dish] sweet or savory?,[dish] tastes ...
Is [dish] spicy?,[dish] tastes ...

Is [dish] healthy?,[dish] is ...
Is [dish] good for you?,[dish] is ...
What are the nutritional benefits of [dish]?,[dish] is ...
Is [dish] high in calories?,[dish] is ...
Is [dish] suitable for vegetarians?,[dish] is ...
Is [dish] suitable for vegans?,[dish] is ... 